{
  "schema_version": "urn:agentapi-doctor:source-lock-set:v1",
  "status": "candidate",
  "review_status": "pending_review",
  "sources": [
    {
      "id": "openai-chat-function-calling",
      "protocol": "openai-chat",
      "source_type": "official_documentation",
      "original_url": "https://developers.openai.com/api/docs/guides/function-calling",
      "resolved_url": "https://developers.openai.com/api/docs/guides/function-calling",
      "retrieved_at": "2026-07-11T23:00:48Z",
      "revision": "content-sha256:fd02b8cc59f93b6e24ab53e2a8382ebb45914b68c5c8ac9b816d27b1445bf450",
      "content_sha256": "sha256:fd02b8cc59f93b6e24ab53e2a8382ebb45914b68c5c8ac9b816d27b1445bf450",
      "license": "not-evaluated",
      "reuse_status": "metadata-only-no-mirroring"
    },
    {
      "id": "openai-chat-streaming",
      "protocol": "openai-chat",
      "source_type": "official_documentation",
      "original_url": "https://developers.openai.com/api/docs/guides/streaming-responses",
      "resolved_url": "https://developers.openai.com/api/docs/guides/streaming-responses",
      "retrieved_at": "2026-07-11T23:00:48Z",
      "revision": "content-sha256:4645bdad3f2309785bec0403f74471c6301411d93b2deb39dd979b5848a85407",
      "content_sha256": "sha256:4645bdad3f2309785bec0403f74471c6301411d93b2deb39dd979b5848a85407",
      "license": "not-evaluated",
      "reuse_status": "metadata-only-no-mirroring"
    },
    {
      "id": "openai-chat-structured-output",
      "protocol": "openai-chat",
      "source_type": "official_documentation",
      "original_url": "https://developers.openai.com/api/docs/guides/structured-outputs",
      "resolved_url": "https://developers.openai.com/api/docs/guides/structured-outputs",
      "retrieved_at": "2026-07-11T23:00:48Z",
      "revision": "content-sha256:ac166ce490f4c863cbe4a50b2d447742c830a0b9a318a2740d0599cb163cf82b",
      "content_sha256": "sha256:ac166ce490f4c863cbe4a50b2d447742c830a0b9a318a2740d0599cb163cf82b",
      "license": "not-evaluated",
      "reuse_status": "metadata-only-no-mirroring"
    },
    {
      "id": "openai-responses-function-calling",
      "protocol": "openai-responses-http",
      "source_type": "official_documentation",
      "original_url": "https://developers.openai.com/api/docs/guides/function-calling",
      "resolved_url": "https://developers.openai.com/api/docs/guides/function-calling",
      "retrieved_at": "2026-07-11T23:00:48Z",
      "revision": "content-sha256:fd02b8cc59f93b6e24ab53e2a8382ebb45914b68c5c8ac9b816d27b1445bf450",
      "content_sha256": "sha256:fd02b8cc59f93b6e24ab53e2a8382ebb45914b68c5c8ac9b816d27b1445bf450",
      "license": "not-evaluated",
      "reuse_status": "metadata-only-no-mirroring"
    },
    {
      "id": "openai-responses-streaming",
      "protocol": "openai-responses-http",
      "source_type": "official_documentation",
      "original_url": "https://developers.openai.com/api/docs/guides/streaming-responses",
      "resolved_url": "https://developers.openai.com/api/docs/guides/streaming-responses",
      "retrieved_at": "2026-07-11T23:00:48Z",
      "revision": "content-sha256:4645bdad3f2309785bec0403f74471c6301411d93b2deb39dd979b5848a85407",
      "content_sha256": "sha256:4645bdad3f2309785bec0403f74471c6301411d93b2deb39dd979b5848a85407",
      "license": "not-evaluated",
      "reuse_status": "metadata-only-no-mirroring"
    },
    {
      "id": "openai-responses-migration",
      "protocol": "openai-responses-http",
      "source_type": "official_documentation",
      "original_url": "https://developers.openai.com/api/docs/guides/migrate-to-responses",
      "resolved_url": "https://developers.openai.com/api/docs/guides/migrate-to-responses",
      "retrieved_at": "2026-07-11T23:00:48Z",
      "revision": "content-sha256:ddebddffd1b53d2e320533932d14f8a6540d4d30885c86c46f988ebcc4a24504",
      "content_sha256": "sha256:ddebddffd1b53d2e320533932d14f8a6540d4d30885c86c46f988ebcc4a24504",
      "license": "not-evaluated",
      "reuse_status": "metadata-only-no-mirroring"
    },
    {
      "id": "openai-responses-structured-output",
      "protocol": "openai-responses-http",
      "source_type": "official_documentation",
      "original_url": "https://developers.openai.com/api/docs/guides/structured-outputs",
      "resolved_url": "https://developers.openai.com/api/docs/guides/structured-outputs",
      "retrieved_at": "2026-07-11T23:00:48Z",
      "revision": "content-sha256:ac166ce490f4c863cbe4a50b2d447742c830a0b9a318a2740d0599cb163cf82b",
      "content_sha256": "sha256:ac166ce490f4c863cbe4a50b2d447742c830a0b9a318a2740d0599cb163cf82b",
      "license": "not-evaluated",
      "reuse_status": "metadata-only-no-mirroring"
    },
    {
      "id": "anthropic-api-overview",
      "protocol": "anthropic-messages",
      "source_type": "official_documentation",
      "original_url": "https://platform.claude.com/docs/en/api/overview",
      "resolved_url": "https://platform.claude.com/docs/en/api/overview",
      "retrieved_at": "2026-07-11T23:03:08Z",
      "revision": "content-sha256:b3e736b411932d5fa471f8a9fe517116f06dfce38dab7a0d89add0274222df74",
      "content_sha256": "sha256:b3e736b411932d5fa471f8a9fe517116f06dfce38dab7a0d89add0274222df74",
      "license": "not-evaluated",
      "reuse_status": "metadata-only-no-mirroring"
    },
    {
      "id": "anthropic-messages-guide",
      "protocol": "anthropic-messages",
      "source_type": "official_documentation",
      "original_url": "https://platform.claude.com/docs/en/build-with-claude/working-with-messages",
      "resolved_url": "https://platform.claude.com/docs/en/build-with-claude/working-with-messages",
      "retrieved_at": "2026-07-11T23:03:08Z",
      "revision": "content-sha256:7ec085e4beebff11c9ab6eba98ed721ca5cdded4f6fa425ee975397a64609fb1",
      "content_sha256": "sha256:7ec085e4beebff11c9ab6eba98ed721ca5cdded4f6fa425ee975397a64609fb1",
      "license": "not-evaluated",
      "reuse_status": "metadata-only-no-mirroring"
    },
    {
      "id": "anthropic-streaming",
      "protocol": "anthropic-messages",
      "source_type": "official_documentation",
      "original_url": "https://platform.claude.com/docs/en/build-with-claude/streaming",
      "resolved_url": "https://platform.claude.com/docs/en/build-with-claude/streaming",
      "retrieved_at": "2026-07-11T23:00:48Z",
      "revision": "content-sha256:ca02c68f990b7c3c727f768ab5058917f16e1fb29fc5e6874651847df816d4c0",
      "content_sha256": "sha256:ca02c68f990b7c3c727f768ab5058917f16e1fb29fc5e6874651847df816d4c0",
      "license": "not-evaluated",
      "reuse_status": "metadata-only-no-mirroring"
    },
    {
      "id": "anthropic-tool-use",
      "protocol": "anthropic-messages",
      "source_type": "official_documentation",
      "original_url": "https://platform.claude.com/docs/en/agents-and-tools/tool-use/overview",
      "resolved_url": "https://platform.claude.com/docs/en/agents-and-tools/tool-use/overview",
      "retrieved_at": "2026-07-11T23:00:48Z",
      "revision": "content-sha256:ce047dd1aa3f79e1f30c0b28822e27d792a6569533c2be03828fc6546b679538",
      "content_sha256": "sha256:ce047dd1aa3f79e1f30c0b28822e27d792a6569533c2be03828fc6546b679538",
      "license": "not-evaluated",
      "reuse_status": "metadata-only-no-mirroring"
    },
    {
      "id": "google-generate-api-overview",
      "protocol": "google-generate-content",
      "source_type": "official_documentation",
      "original_url": "https://ai.google.dev/api",
      "resolved_url": "https://ai.google.dev/api",
      "retrieved_at": "2026-07-11T23:03:08Z",
      "revision": "content-sha256:6a69be885b2323f848ab4cf09e1c13e6ad41fd3e8ff99aa65bce483c7839b391",
      "content_sha256": "sha256:6a69be885b2323f848ab4cf09e1c13e6ad41fd3e8ff99aa65bce483c7839b391",
      "license": "CC-BY-4.0 documentation; Apache-2.0 samples",
      "reuse_status": "metadata-only-no-mirroring"
    },
    {
      "id": "google-generate-api-reference",
      "protocol": "google-generate-content",
      "source_type": "official_documentation",
      "original_url": "https://ai.google.dev/api/generate-content",
      "resolved_url": "https://ai.google.dev/api/generate-content",
      "retrieved_at": "2026-07-11T23:03:08Z",
      "revision": "content-sha256:93d353571a2dd98afbd94783f33989f095bfb22a641ae48a3c786443d7172272",
      "content_sha256": "sha256:93d353571a2dd98afbd94783f33989f095bfb22a641ae48a3c786443d7172272",
      "license": "CC-BY-4.0 documentation; Apache-2.0 samples",
      "reuse_status": "metadata-only-no-mirroring"
    },
    {
      "id": "google-generate-function-calling",
      "protocol": "google-generate-content",
      "source_type": "official_documentation",
      "original_url": "https://ai.google.dev/gemini-api/docs/function-calling",
      "resolved_url": "https://ai.google.dev/gemini-api/docs/function-calling",
      "retrieved_at": "2026-07-11T23:00:48Z",
      "revision": "content-sha256:9022fb0084b7aa4e8f8bc43f14ac338fcf94ba3728ccad97274ac1302ff70546",
      "content_sha256": "sha256:9022fb0084b7aa4e8f8bc43f14ac338fcf94ba3728ccad97274ac1302ff70546",
      "license": "CC-BY-4.0 documentation; Apache-2.0 samples",
      "reuse_status": "metadata-only-no-mirroring"
    },
    {
      "id": "google-generate-streaming",
      "protocol": "google-generate-content",
      "source_type": "official_documentation",
      "original_url": "https://ai.google.dev/gemini-api/docs/streaming",
      "resolved_url": "https://ai.google.dev/gemini-api/docs/streaming",
      "retrieved_at": "2026-07-11T23:00:48Z",
      "revision": "content-sha256:dd8dbf5d9e32c2897325fe37e3fe5dcf3cff1ecc348c1d123a3991b30200e4e4",
      "content_sha256": "sha256:dd8dbf5d9e32c2897325fe37e3fe5dcf3cff1ecc348c1d123a3991b30200e4e4",
      "license": "CC-BY-4.0 documentation; Apache-2.0 samples",
      "reuse_status": "metadata-only-no-mirroring"
    },
    {
      "id": "google-interactions-api",
      "protocol": "google-interactions",